{
  "$schema": "https://json-schema.org/draft/2020-12/schema",
  "$id": "https://github.com/AlexandraIourenkova/bob-skills-marketplace/schemas/pack.schema.json",
  "title": "Bob skill pack manifest (pack.json)",
  "description": "One pack = one installable unit for IBM Bob: skills plus optional MCP servers, rules, slash commands and custom modes. Lives at packs/<vendor>/<name>/pack.json. The release tag is `<name>--v<version>`.",
  "type": "object",
  "additionalProperties": false,
  "required": [
    "name",
    "displayName",
    "version",
    "vendor",
    "description",
    "skills"
  ],
  "properties": {
    "$schema": {
      "type": "string"
    },
    "name": {
      "type": "string",
      "pattern": "^[a-z0-9][a-z0-9-]{1,63}$",
      "description": "Pack id, unique across the registry. Used in `bob-skills add <name>` and `/skills-add <name>`."
    },
    "displayName": {
      "type": "string",
      "minLength": 1,
      "maxLength": 80
    },
    "version": {
      "$ref": "#/$defs/semver",
      "description": "Semantic version of the pack. A change to any shipped file requires a new version."
    },
    "vendor": {
      "type": "string",
      "pattern": "^[a-z0-9][a-z0-9-]{1,63}$",
      "description": "Vendor id from vendors.json. Must equal the parent folder under packs/."
    },
    "description": {
      "type": "string",
      "minLength": 20,
      "maxLength": 500
    },
    "safety": {
      "type": "array",
      "description": "Known risks a user must see before installing: what the pack's skills do that needs care, and what closes it. Shown by `bob-skills show`, by `add`, in the offline catalog and on the website. A pack whose skills write to external systems declares it here.",
      "items": {
        "type": "object",
        "additionalProperties": false,
        "required": [
          "warning",
          "covered"
        ],
        "properties": {
          "class": {
            "type": "string",
            "enum": [
              "writes",
              "cost",
              "content",
              "transport",
              "data"
            ],
            "description": "writes: changes outside the workspace; cost: billable resources; content: outside content can steer actions; transport: TLS or exposure; data: data leaves the machine."
          },
          "warning": {
            "type": "string",
            "minLength": 20,
            "description": "What the skills do, in the user's terms."
          },
          "covered": {
            "type": "string",
            "minLength": 20,
            "description": "What closes it in practice: the rule, the confirmation step, the setting."
          }
        }
      }
    },
    "license": {
      "type": "string",
      "description": "SPDX identifier of the shipped content, e.g. MIT."
    },
    "homepage": {
      "type": "string",
      "format": "uri"
    },
    "source": {
      "type": "object",
      "additionalProperties": false,
      "required": [
        "repo",
        "ref"
      ],
      "description": "Upstream the skills were synced from, when they are not authored in this registry.",
      "properties": {
        "repo": {
          "type": "string",
          "format": "uri"
        },
        "ref": {
          "type": "string",
          "description": "Tag or commit in the upstream repository."
        },
        "path": {
          "type": "string",
          "description": "Folder inside the upstream repository."
        },
        "exclude": {
          "type": "array",
          "items": {
            "type": "string",
            "minLength": 1
          },
          "uniqueItems": true,
          "description": "Names of files or folders left out of every synced skill, as shell-style patterns matched against each name, for example evals for upstream test fixtures."
        }
      }
    },
    "minBob": {
      "$ref": "#/$defs/semver",
      "description": "Minimum IBM Bob version the pack was tested with."
    },
    "tags": {
      "type": "array",
      "items": {
        "type": "string",
        "pattern": "^[a-z0-9][a-z0-9.-]*$"
      },
      "uniqueItems": true,
      "maxItems": 20
    },
    "skills": {
      "type": "array",
      "items": {
        "type": "string",
        "pattern": "^[a-z0-9][a-z0-9-]*$"
      },
      "uniqueItems": true,
      "description": "Skill folders under skills/. Each must contain SKILL.md whose frontmatter `name` equals the folder name and has a non-empty `description` (Bob ignores a skill without one)."
    },
    "mcpServers": {
      "type": "object",
      "additionalProperties": {
        "$ref": "#/$defs/mcpServer"
      },
      "description": "Servers merged into .bob/mcp.json (project) or ~/.bob/mcp.json (--global). Keys are server names. Checked by the registry: pinned versions, https, no secrets, no pre-approved tools, TLS verification on."
    },
    "mcpAccess": {
      "type": "object",
      "description": "Reviewed access level of every server in mcpServers. read-only: how writes are kept out (a tool allow-list, a read-only mode, or a server that only reads). read-write: why the pack needs writes and which confirmation guards each one. The registry refuses a pack whose server has no entry.",
      "additionalProperties": {
        "type": "object",
        "additionalProperties": false,
        "required": [
          "access",
          "reason"
        ],
        "properties": {
          "access": {
            "type": "string",
            "enum": [
              "read-only",
              "read-write"
            ]
          },
          "reason": {
            "type": "string",
            "minLength": 20
          }
        }
      }
    },
    "rules": {
      "type": "array",
      "items": {
        "type": "string",
        "pattern": "^rules/[A-Za-z0-9_.-]+\\.md$"
      },
      "uniqueItems": true,
      "description": "Markdown rule files copied into .bob/rules/."
    },
    "commands": {
      "type": "array",
      "items": {
        "type": "string",
        "pattern": "^commands/[A-Za-z0-9_.-]+\\.md$"
      },
      "uniqueItems": true,
      "description": "Bob Shell slash commands copied into .bob/commands/."
    },
    "modes": {
      "type": "string",
      "const": "custom_modes.yaml",
      "description": "Custom modes file whose `customModes` entries are merged by slug into .bob/custom_modes.yaml."
    },
    "networkAllow": {
      "type": "array",
      "items": {
        "type": "string"
      },
      "uniqueItems": true,
      "description": "Hosts (glob) the pack's scripts may contact. Must be a subset of the vendor's allow-list in vendors.json. Anything else in code is a blocking policy finding."
    },
    "revokedVersions": {
      "type": "array",
      "items": {
        "$ref": "#/$defs/semver"
      },
      "uniqueItems": true,
      "description": "Versions the vendor has withdrawn. The installer refuses them, `update` offers a rollback, the guard refuses to activate their skills."
    },
    "checksums": {
      "type": "object",
      "propertyNames": {
        "pattern": "^(skills/[a-z0-9-]+|rules/[A-Za-z0-9_.-]+\\.md|commands/[A-Za-z0-9_.-]+\\.md|custom_modes\\.yaml)$"
      },
      "additionalProperties": {
        "$ref": "#/$defs/digest"
      },
      "description": "Digest per shipped component. Maintained by `bob-skills registry validate --fix`; CI fails when a checksum does not match the tree. See docs/pack-format.md for the algorithm."
    },
    "generated": {
      "type": "array",
      "items": {
        "type": "string"
      },
      "uniqueItems": true,
      "description": "Files inside the pack that the registry tooling regenerates (for example the offline catalog in find-skills). They are checksummed like everything else, but a difference against the release tag in these files does not require a new version."
    },
    "sources": {
      "type": "object",
      "propertyNames": {
        "pattern": "^[a-z0-9][a-z0-9-]*$"
      },
      "additionalProperties": {
        "type": "object",
        "additionalProperties": false,
        "required": [
          "repo",
          "ref"
        ],
        "properties": {
          "repo": {
            "type": "string",
            "format": "uri"
          },
          "ref": {
            "type": "string"
          },
          "path": {
            "type": "string"
          }
        }
      },
      "description": "Per-skill upstream overrides for packs curated from more than one repository; keys are skill names, values have the shape of `source`."
    }
  },
  "$defs": {
    "semver": {
      "type": "string",
      "pattern": "^(0|[1-9]\\d*)\\.(0|[1-9]\\d*)\\.(0|[1-9]\\d*)(-[0-9A-Za-z.-]+)?$"
    },
    "digest": {
      "type": "string",
      "pattern": "^sha256:[0-9a-f]{64}$"
    },
    "mcpServer": {
      "type": "object",
      "additionalProperties": true,
      "properties": {
        "type": {
          "type": "string",
          "enum": [
            "stdio",
            "streamable-http",
            "sse"
          ]
        },
        "command": {
          "type": "string"
        },
        "args": {
          "type": "array",
          "items": {
            "type": "string"
          }
        },
        "env": {
          "type": "object",
          "additionalProperties": {
            "type": "string"
          }
        },
        "url": {
          "type": "string",
          "format": "uri"
        },
        "headers": {
          "type": "object",
          "additionalProperties": {
            "type": "string"
          }
        },
        "alwaysAllow": {
          "type": "array",
          "items": {
            "type": "string"
          }
        },
        "disabled": {
          "type": "boolean"
        }
      },
      "oneOf": [
        {
          "required": [
            "command"
          ]
        },
        {
          "required": [
            "url"
          ]
        }
      ]
    }
  }
}
