{
  "$schema": "../../../schemas/pack.schema.json",
  "name": "presentations",
  "displayName": "Presentations that tell a story",
  "version": "1.9.0",
  "vendor": "ibm",
  "description": "From a topic or the user's data to a deck people remember, and the talk around it: story structures by audience and goal, a headline-per-slide storyboard, five conceptually different style concepts previewed for the user to choose, charts that say one thing, a bundled picture library, Carbon icons and pattern tiles. One storyboard builds three ways: an interactive HTML presentation, a printable HTML for PDF, and a styled 16:9 PowerPoint file. Original IBM skills, offline.",
  "license": "Apache-2.0",
  "homepage": "https://github.ibm.com/Maria-Startseva/bob-skills-marketplace",
  "minBob": "2.0.2",
  "tags": [
    "presentations",
    "pptx",
    "html",
    "slides",
    "storytelling",
    "dataviz",
    "pitch",
    "ibm"
  ],
  "skills": [
    "presentation",
    "deck-story",
    "deck-style",
    "deck-dataviz",
    "deck-images",
    "deck-pitch"
  ],
  "rules": [
    "rules/presentations.md"
  ],
  "commands": [
    "commands/deck.md"
  ],
  "modes": "custom_modes.yaml",
  "networkAllow": [
    "pypi.org",
    "files.pythonhosted.org"
  ],
  "revokedVersions": [],
  "checksums": {
    "skills/presentation": "sha256:94850c9c0a78a2addf513e6aef3395f4d86e9556f7b9957d3bd13de8f0e73d12",
    "skills/deck-story": "sha256:499635b753eee41e3c03d7b7c705a5476e2ac2afb0d967409ae941b448d19c03",
    "skills/deck-style": "sha256:bbf9dced38c859971e8a2663425fe7cd7b2ef9a6c9164bcadd458a87259cbdac",
    "skills/deck-dataviz": "sha256:03d1c1829ff1e13d7df88075a6c2098a6da7b03eea6dcd7e4d47d8713825999c",
    "skills/deck-images": "sha256:38a2ab26004817e1dea231406d09d87adc048b2f422b45704e5d5f648b4af619",
    "skills/deck-pitch": "sha256:1bcc35cdf6725967145fde090609579db1940842dedc18701ec744f0173f4486",
    "rules/presentations.md": "sha256:8e8bcc73a1e3aa8f18451598fb9a1f3e14d4d4528bfa43bab604dfcd35c25829",
    "commands/deck.md": "sha256:b277413211ab57cd21c3b5ec3d4a10f7c4453fb992f49c069043963ffcf276cc",
    "custom_modes.yaml": "sha256:b691692372cd58d30b6695f607ba2ef72d6c97357d69def4d0b243f924e4b82d"
  }
}
