{
  "$schema": "../../../schemas/pack.schema.json",
  "name": "confluent-kafka",
  "displayName": "Kafka and Flink by Confluent",
  "version": "1.0.0",
  "vendor": "confluent",
  "description": "Build Kafka producers, consumers and Kafka Streams apps with Schema Registry, bring unmanaged schemas under Schema Registry with PII tags, write Flink SQL and Java UDFs, set up CDC pipelines into Iceberg or Delta tables with Tableflow, and plan a move from AWS MSK to Confluent Cloud. Confluent's official skills, curated from confluentinc/agent-skills with the evals Confluent scores them against.",
  "license": "Apache-2.0",
  "homepage": "https://github.com/confluentinc/agent-skills",
  "source": {
    "repo": "https://github.com/confluentinc/agent-skills",
    "ref": "914d95eff7ff50513b34bfb9ac97eda7c7fce899",
    "path": "skills"
  },
  "minBob": "2.0.2",
  "tags": [
    "kafka",
    "flink",
    "streaming",
    "schema-registry",
    "cdc",
    "confluent"
  ],
  "skills": [
    "developing-kafka-java-client",
    "developing-kafka-python-client",
    "kafka-streams-programming",
    "kafka-schema-registry",
    "flink-udf",
    "confluent-cloud-flink-sql",
    "confluent-cloud-cdc-tableflow",
    "msk-migration"
  ],
  "networkAllow": [
    "*.confluent.io",
    "*.confluent.cloud",
    "kafka.apache.org"
  ],
  "revokedVersions": [],
  "checksums": {
    "skills/developing-kafka-java-client": "sha256:29923d0fd0de4a88130993274b9d8c30a9ddb369d9521b4bf158fa20cfaba034",
    "skills/developing-kafka-python-client": "sha256:9ff0c811f415b8185e3b1761f8ccc47724d1bee80fca49ec718d4c8bc5a5831d",
    "skills/kafka-streams-programming": "sha256:cfd6f26d31a7027c8c15c2bb89fbed2ca1ac481268cdaeaf25c4d074d5f7a65c",
    "skills/kafka-schema-registry": "sha256:d9cf4dd1e7524c98c7e4f3e5ac9c27d0d7c8fa0ccd972118ae50c53c29c62b7b",
    "skills/flink-udf": "sha256:d5b0e4cb294a2a07ffd26e69d218e2ff120f375c1b6a5b0331f4b331f58596f7",
    "skills/confluent-cloud-flink-sql": "sha256:969c7e8ecfa42052f40f6c3d223d129026881d7f86376cc3bfd46d8b1ba99bb6",
    "skills/confluent-cloud-cdc-tableflow": "sha256:1e267c996c609e3286dbce600f6a8d2881d225ce43446535a54aaa212c9b2644",
    "skills/msk-migration": "sha256:8ff873fcf4b0b298c6fe522b0e2a8c4939367964ed60e762c45cc30e86092dfc"
  }
}
