{
  "$schema": "../../../schemas/pack.schema.json",
  "name": "challenge-kit",
  "displayName": "Challenge kit: from the first idea to the submission",
  "version": "1.0.0",
  "vendor": "ibm",
  "description": "For teams in an AI coding challenge or hackathon, newcomers and experienced alike. A guided first session, ideas when there is nothing to start from, a process rethought, a scope with invented data, a solution blueprint with an architecture diagram, a usability pass, the demo script and a check before submitting.",
  "license": "Apache-2.0",
  "homepage": "https://github.com/AlexandraIourenkova/bob-skills-marketplace",
  "minBob": "2.0.2",
  "tags": [
    "challenge",
    "hackathon",
    "ideas",
    "proof-of-concept",
    "process",
    "architecture",
    "diagram",
    "business-case",
    "synthetic-data",
    "usability",
    "demo",
    "submission",
    "ibm"
  ],
  "skills": [
    "first-hour",
    "idea-studio",
    "process-redesign",
    "poc-scope",
    "solution-blueprint",
    "usability-pass",
    "demo-script",
    "submission-check"
  ],
  "rules": [
    "rules/challenge-kit.md"
  ],
  "commands": [
    "commands/challenge.md"
  ],
  "modes": "custom_modes.yaml",
  "networkAllow": [],
  "safety": [
    {
      "class": "data",
      "warning": "The skills write what you tell them about your company's processes, people, volumes and costs into files under `challenge/`, and a challenge entry is usually submitted as a public repository.",
      "covered": "Nothing leaves the machine: the scripts have no network code and the page is one local HTML file. The rule assumes company data may not leave the company, `poc-scope` makes invented data for the build, and `submission-check` looks for credentials and real-looking data before a public push. Credentials never go into a file or a command line, and a found one is shown masked."
    },
    {
      "class": "content",
      "warning": "The skills read process documents, exports, emails and the files and git history of your repository, and `usability-pass` reads what your running solution shows. Such material can carry text aimed at Bob.",
      "covered": "The rule, the mode and each skill treat that material as data: quoted and reported, never followed. The challenge-coach mode can edit only under `challenge/`, the renderer escapes every string of the spec, and the pack changes no code, rewrites no git history, rotates no key, pushes nothing and installs no other pack: those steps are yours."
    }
  ],
  "revokedVersions": [],
  "checksums": {
    "skills/first-hour": "sha256:3a2e3cb04ed06068c6c57da8d7bc2b92b54a670c522516674e2d0939779e78bf",
    "skills/idea-studio": "sha256:78959e0bbb27d878f3ae5a2cb9dacfaf0eaee9817664592e108160494a447302",
    "skills/process-redesign": "sha256:1eb14cdf2936bbc1b9e75171de892ca07e310aee0196032dd8867c2df9d65a61",
    "skills/poc-scope": "sha256:42e628919ce73dd54effd776973fe996687d73f9566a74c94c61c1be07dae134",
    "skills/solution-blueprint": "sha256:2158a3295ad3729958c13a0e4e63196f73a0cc576f861ba6ca9c29c361548622",
    "skills/usability-pass": "sha256:8986630f099c6bc696afcf908f68797f16c57e0d50e54a76df9442d4ad9f519e",
    "skills/demo-script": "sha256:5a1a2e9762ad1d174436fc37148c018ea3c26950dfde8e0cb0307180ffcb531b",
    "skills/submission-check": "sha256:6d98dbf2d1b3c4d22c5812f4973dfd1754b1486151f7a6983b9ba7125a21faac",
    "rules/challenge-kit.md": "sha256:c729494dc01f858425685d35b2aaa7c83cc8c2dbdc66f1123b7890a154573b39",
    "commands/challenge.md": "sha256:5297741a40cb8305e5806e2c145db9174c90cbbe78d1968a9ae3ed319a8e96b5",
    "custom_modes.yaml": "sha256:afa1361c4bc8b173d08f2b6fed50db7604317ffedb49e1c06a72f6d4538fd9cc"
  }
}
