{
  "$schema": "../../../schemas/pack.schema.json",
  "name": "zos-app-insight",
  "displayName": "z/OS application insight",
  "version": "1.1.0",
  "vendor": "ibm",
  "description": "Map a COBOL, PL/I, REXX and Assembler application with its JCL, build its data dictionary, document its programs and business rules, and review COBOL, PL/I and REXX for performance, from source in your workspace or downloaded read-only from z/OS. A starter pack; for IBM's own scanners, refactoring and IBM Z documentation in answers, use IBM Bob Premium Package for Z.",
  "safety": [
    {
      "class": "data",
      "warning": "The COBOL, PL/I, REXX, Assembler and JCL you analyse, and members downloaded from z/OS, go into Bob's model context like any file you open.",
      "covered": "The scripts send nothing over the network; the only network step is the optional Zowe CLI download through your own profile, after your yes to the plan it prints. The rule keeps quotes to the cited lines and suggests git-ignoring zos-insight/src/."
    },
    {
      "class": "content",
      "warning": "Comments, literals and copybook text in mainframe source can carry text aimed at Bob.",
      "covered": "The pack rule treats all source as data: documentation and findings quote it as evidence and never follow it."
    }
  ],
  "license": "Apache-2.0",
  "homepage": "https://github.com/AlexandraIourenkova/bob-skills-marketplace",
  "minBob": "2.0.2",
  "tags": [
    "cobol",
    "pli",
    "rexx",
    "assembler",
    "jcl",
    "mainframe",
    "z-os",
    "documentation",
    "data-dictionary",
    "performance",
    "ibm"
  ],
  "skills": [
    "zos-app-map",
    "zos-data-dictionary",
    "zos-program-doc",
    "cobol-perf-review"
  ],
  "rules": [
    "rules/zos-app-insight.md"
  ],
  "commands": [
    "commands/zos-insight.md"
  ],
  "modes": "custom_modes.yaml",
  "networkAllow": [],
  "revokedVersions": [],
  "checksums": {
    "skills/zos-app-map": "sha256:6673f51e38a372ef01e4b527015e7beaf7b86e209939a823de4ba0c955f0e189",
    "skills/zos-data-dictionary": "sha256:74f44b3b5281722fa391ac9c94d82ae2ac556d0653d1478eac29d59ce5a065b0",
    "skills/zos-program-doc": "sha256:cb9b4684e26a13ae09a00362c3c4324dba22b35e22e82fc985fddb9b61e1c42f",
    "skills/cobol-perf-review": "sha256:3d714ac9d430dd8b80b5316244750d87ef0fd279ee6effd5f6564ea6029bd6cb",
    "rules/zos-app-insight.md": "sha256:f0764d1ecc06d8db60579711857b594bfc1d36d09f064cd29212dbca0e221569",
    "commands/zos-insight.md": "sha256:d98f55b8bf389ec36b2f9f9293e0b828ae1dba2e02f86d18ef1be022c596a817",
    "custom_modes.yaml": "sha256:7ef8a7552ee93be0fd8de8dce1847d3e503588fe5395f18cb9b41929a91ff7c7"
  }
}
