{
  "$schema": "../../../schemas/pack.schema.json",
  "name": "wxo-adk",
  "displayName": "watsonx Orchestrate ADK",
  "version": "1.1.0",
  "vendor": "ibm",
  "description": "The six official watsonx Orchestrate ADK skills for the whole agent lifecycle (requirements, SOP, build, audit, telemetry, instruction quality) plus IBM's official wxo-agent-architect skill, the ADK and documentation MCP servers, an ADK rule, a /wxo-deploy command and a wxo-builder mode.",
  "license": "MIT",
  "homepage": "https://github.com/IBM/ibm-watsonx-orchestrate-adk/tree/main/skills",
  "source": {
    "repo": "https://github.com/IBM/ibm-watsonx-orchestrate-adk",
    "ref": "128062277c49",
    "path": "skills"
  },
  "minBob": "2.0.2",
  "tags": [
    "watsonx-orchestrate",
    "wxo",
    "adk",
    "agents",
    "ibm"
  ],
  "skills": [
    "solution-architect",
    "sop-builder",
    "wxo-builder",
    "wxo-analyzer",
    "telemetry-analyzer",
    "agent-instructions-evaluator",
    "wxo-agent-architect"
  ],
  "mcpServers": {
    "watsonx-orchestrate-adk": {
      "command": "uvx",
      "args": [
        "ibm-watsonx-orchestrate-mcp-server"
      ]
    },
    "watsonx-orchestrate-adk-docs": {
      "type": "streamable-http",
      "url": "https://developer.watson-orchestrate.ibm.com/mcp"
    }
  },
  "rules": [
    "rules/wxo-adk.md"
  ],
  "commands": [
    "commands/wxo-deploy.md"
  ],
  "modes": "custom_modes.yaml",
  "networkAllow": [
    "*.ibm.com",
    "ibm.com",
    "pypi.org",
    "github.com"
  ],
  "revokedVersions": [],
  "checksums": {
    "skills/solution-architect": "sha256:685da057cb4773aea4242caa108ffad63596b01bb393dec7f2180d48d835e6d3",
    "skills/sop-builder": "sha256:42fd89cf838bbcec6295c06c5a54b685c8615ba8ffec12f2f5babb7e57edbbf3",
    "skills/wxo-builder": "sha256:342f92637b216e8ec856de5d273be76d1ab3d1a86f76843d836c25d53ec6f60f",
    "skills/wxo-analyzer": "sha256:9827d600438df05d251fb7472fec0d6b0da1336309eb94ea6f3322f13edd4f51",
    "skills/telemetry-analyzer": "sha256:28a666e771a0dd23c7b93ff126d2739d1cde6d06b1c2ed6f32c489cc6a91043f",
    "skills/agent-instructions-evaluator": "sha256:4000fb84eb01c92d0b2b3e8b36a362d2911dcd87c9d0f1444cf1ac974b557902",
    "skills/wxo-agent-architect": "sha256:c716450019dd17ef6dc3dd066e6233a3ff75dfb84ff7220215064cf2a80ea894",
    "rules/wxo-adk.md": "sha256:54a09683667629b52ffd3e3e687aafa9a62989aa6eac7bbb4769c9660454e3d2",
    "commands/wxo-deploy.md": "sha256:14d3ad8b8d350d810817783eea3a15c464bb177ddfee03445a4172a6339f0daf",
    "custom_modes.yaml": "sha256:b6c152af5ea852830e4b24dbfa5851eb03a051c47e72f19b4acd5c5b9976b342"
  },
  "sources": {
    "wxo-agent-architect": {
      "repo": "https://github.com/IBM/agentic-ai-labs-skills",
      "ref": "7a96fcd752f8",
      "path": "plugins/wxo-agent-architect/skills"
    }
  }
}
